{
  "actual_provider_calls_performed": 0,
  "allocation_manifest_hash": "sha256:ce03def17f2e7aefee63e77f1296e5902de702fbea1d1748944327ea1f0a69e8",
  "blockers": [
    "provider/model/account account availability",
    "runtime settings",
    "pricing",
    "final authorization",
    "human coding",
    "model execution"
  ],
  "condition_count": 3,
  "created_at": "2026-07-10T00:00:00+10:00",
  "execution_allowed": false,
  "explicit_execution_blocked_reason": "Provider/account, runtime settings, pricing, final authorization, human coding, and model execution gates are BLOCKED.",
  "final_authorization_status": "BLOCKED",
  "human_coding_status": "BLOCKED",
  "manual_manifest_hash": "sha256:1b80c0931a0ed8159aaeeb6e7b348331beb33130776469f223ae2a8cfe89d8de",
  "model_execution_status": "BLOCKED",
  "model_response_schema_hash": "sha256:84fbc5413951c712925d85738bc820d776c1ab06172382f143e48495d4a095ec",
  "ordering_rule": "frozen PR #18 allocation_manifest.case_order with its primary, stability, and ablation run roles",
  "outputs_generated": 0,
  "overall_execution_status": "EXECUTION_BLOCKED",
  "packets_inspected": 0,
  "plan_status": "DRY_RUN_VALID_EXECUTION_BLOCKED",
  "planned_run_count": 118,
  "pr18_reference_head_sha": "eac65f27bbe302a17e5f508ac1d516178e917aea",
  "pricing_gate_status": "BLOCKED",
  "private_packet_gate_status": "PASSED_WITH_CONTROLLED_ACCESS_ONLY",
  "prompt_assembly_manifest_hash": "sha256:1c20de3eef8279220df8e6be2ae3337fc4a40e9f91d789ca8f305e601c805d08",
  "provider_calls_planned_but_not_authorized": 118,
  "provider_model_account_gate_status": "BLOCKED",
  "record_hash": "sha256:7e4f8bd9f465688abb42c16e68fcc860116bea35096fdb90806994eb4e0819ef",
  "requests_transmitted": 0,
  "responses_received": 0,
  "rights_gate_status": "PASSED_WITH_DOWNSTREAM_GATES_BLOCKED",
  "runtime_gate_status": "BLOCKED",
  "schema_version": "1.0.0",
  "selected_case_count": 25
}
